{
  "schemaVersion": "1.0.0",
  "id": "beatrix",
  "name": "Beatrix",
  "releaseYear": 2021,
  "skillsVerified": true,
  "resourceType": "none",
  "damageType": "physical",
  "roles": [
    "Marksman"
  ],
  "specialties": [
    "Finisher",
    "Damage"
  ],
  "lanes": [
    "Gold"
  ],
  "maxLevel": 15,
  "baseStats": {
    "hp": {
      "base": 2550,
      "growth": 153.5
    },
    "hpRegen": {
      "base": 7.2,
      "growth": 0.2
    },
    "mana": {
      "base": 0,
      "growth": 0
    },
    "manaRegen": {
      "base": 0,
      "growth": 0
    },
    "physicalAttack": {
      "base": 110,
      "growth": 10
    },
    "magicPower": {
      "base": 0,
      "growth": 0
    },
    "physicalDefense": {
      "base": 20,
      "growth": 3.1429
    },
    "magicDefense": {
      "base": 15,
      "growth": 1.6429
    },
    "attackSpeed": {
      "base": 1.07,
      "growth": 0.025
    },
    "attackSpeedRatio": 1,
    "movementSpeed": {
      "base": 257,
      "growth": 0
    },
    "critChance": {
      "base": 0,
      "growth": 0
    }
  },
  "skills": [
    {
      "slot": "passive",
      "name": "Mechanical Genius",
      "maxLevel": 1,
      "algorithms": [
        {
          "id": "passive_auto",
          "trigger": "on_cast",
          "outputs": []
        }
      ]
    },
    {
      "slot": "skill_1",
      "name": "Masterful Gunner",
      "maxLevel": 6,
      "algorithms": [
        {
          "id": "skill_1_auto",
          "trigger": "on_cast",
          "outputs": []
        }
      ],
      "cooldownSeconds": [
        12,
        11,
        10,
        9,
        8,
        7
      ]
    },
    {
      "slot": "skill_2",
      "name": "Tactical Reposition",
      "maxLevel": 6,
      "algorithms": [
        {
          "id": "skill_2_auto",
          "trigger": "on_cast",
          "outputs": []
        }
      ],
      "cooldownSeconds": [
        8,
        8,
        8,
        8,
        8,
        8
      ]
    },
    {
      "slot": "ultimate",
      "name": "Renner's Apathy",
      "maxLevel": 3,
      "algorithms": [
        {
          "id": "ultimate_auto",
          "trigger": "on_cast",
          "inputs": [
            "physical_attack",
            "skill_level"
          ],
          "outputs": [
            {
              "type": "damage_physical",
              "formula": "(700 + 250 * (skill_level - 1)) + 2.8 * physical_attack",
              "magnitudeUnit": "flat"
            }
          ]
        }
      ],
      "cooldownSeconds": [
        24,
        24,
        24
      ]
    }
  ],
  "sources": [
    {
      "field": "baseStats",
      "url": "https://mobile-legends.fandom.com/wiki/Beatrix",
      "retrieved": "2026-06-29"
    },
    {
      "field": "skills",
      "url": "https://mobile-legends.fandom.com/wiki/Beatrix",
      "retrieved": "2026-06-29"
    }
  ]
}
