{
  "schemaVersion": "1.0.0",
  "id": "faramis",
  "name": "Faramis",
  "releaseYear": 2018,
  "skillsVerified": false,
  "resourceType": "mana",
  "damageType": "magic",
  "roles": [
    "Mage",
    "Support"
  ],
  "specialties": [
    "Guard",
    "Charge"
  ],
  "lanes": [
    "Mid",
    "Roam"
  ],
  "maxLevel": 15,
  "baseStats": {
    "hp": {
      "base": 2543,
      "growth": 168.5
    },
    "hpRegen": {
      "base": 6.8,
      "growth": 0.2857
    },
    "mana": {
      "base": 500,
      "growth": 100
    },
    "manaRegen": {
      "base": 4,
      "growth": 0.2
    },
    "physicalAttack": {
      "base": 143,
      "growth": 5.21
    },
    "magicPower": {
      "base": 0,
      "growth": 0
    },
    "physicalDefense": {
      "base": 20,
      "growth": 3.2857
    },
    "magicDefense": {
      "base": 15,
      "growth": 1.6429
    },
    "attackSpeed": {
      "base": 0.98,
      "growth": 0.0079
    },
    "attackSpeedRatio": 1,
    "movementSpeed": {
      "base": 245,
      "growth": 0
    },
    "critChance": {
      "base": 0,
      "growth": 0
    }
  },
  "skills": [
    {
      "slot": "passive",
      "name": "Vicious Retrieval",
      "maxLevel": 1,
      "algorithms": [
        {
          "id": "todo",
          "todo": "Author from wiki: https://mobile-legends.fandom.com/wiki/Faramis",
          "outputs": []
        }
      ]
    },
    {
      "slot": "skill_1",
      "name": "Shadow Stampede",
      "maxLevel": 6,
      "algorithms": [
        {
          "id": "todo",
          "todo": "Author from wiki: https://mobile-legends.fandom.com/wiki/Faramis",
          "outputs": []
        }
      ]
    },
    {
      "slot": "skill_2",
      "name": "Ghost Bursters",
      "maxLevel": 6,
      "algorithms": [
        {
          "id": "todo",
          "todo": "Author from wiki: https://mobile-legends.fandom.com/wiki/Faramis",
          "outputs": []
        }
      ]
    },
    {
      "slot": "ultimate",
      "name": "Nether Realm",
      "maxLevel": 3,
      "algorithms": [
        {
          "id": "todo",
          "todo": "Author from wiki: https://mobile-legends.fandom.com/wiki/Faramis",
          "outputs": []
        }
      ]
    }
  ],
  "sources": [
    {
      "field": "baseStats",
      "url": "https://mobile-legends.fandom.com/wiki/Faramis",
      "retrieved": "2026-06-29"
    }
  ]
}
