{
  "schemaVersion": "1.0.0",
  "id": "granger",
  "name": "Granger",
  "releaseYear": 2019,
  "skillsVerified": true,
  "resourceType": "energy",
  "damageType": "physical",
  "roles": [
    "Marksman"
  ],
  "specialties": [
    "Burst",
    "Finisher"
  ],
  "lanes": [
    "Gold"
  ],
  "maxLevel": 15,
  "baseStats": {
    "hp": {
      "base": 2260,
      "growth": 140
    },
    "hpRegen": {
      "base": 5.4,
      "growth": 0.2
    },
    "mana": {
      "base": 0,
      "growth": 0
    },
    "manaRegen": {
      "base": 0,
      "growth": 0
    },
    "physicalAttack": {
      "base": 116,
      "growth": 15
    },
    "magicPower": {
      "base": 0,
      "growth": 0
    },
    "physicalDefense": {
      "base": 15,
      "growth": 4
    },
    "magicDefense": {
      "base": 15,
      "growth": 2.5
    },
    "attackSpeed": {
      "base": 1.02,
      "growth": 0.015
    },
    "attackSpeedRatio": 1,
    "movementSpeed": {
      "base": 240,
      "growth": 0
    },
    "critChance": {
      "base": 0,
      "growth": 0
    }
  },
  "skills": [
    {
      "slot": "passive",
      "name": "Capriccio",
      "maxLevel": 1,
      "algorithms": [
        {
          "id": "passive_auto",
          "trigger": "on_cast",
          "outputs": []
        }
      ]
    },
    {
      "slot": "skill_1",
      "name": "Rhapsody",
      "maxLevel": 6,
      "algorithms": [
        {
          "id": "skill_1_auto",
          "trigger": "on_cast",
          "inputs": [
            "physical_attack",
            "skill_level"
          ],
          "outputs": [
            {
              "type": "damage_physical",
              "formula": "(60 + 12 * (skill_level - 1)) + 0.5 * physical_attack",
              "magnitudeUnit": "flat",
              "hits": 6
            }
          ]
        }
      ],
      "cooldownSeconds": [
        0.3,
        0.3,
        0.3,
        0.3,
        0.3,
        0.3
      ]
    },
    {
      "slot": "skill_2",
      "name": "Rondo",
      "maxLevel": 6,
      "algorithms": [
        {
          "id": "skill_2_auto",
          "trigger": "on_cast",
          "outputs": []
        }
      ],
      "cooldownSeconds": [
        12,
        12,
        12,
        12,
        12,
        12
      ]
    },
    {
      "slot": "ultimate",
      "name": "Death Sonata",
      "maxLevel": 3,
      "algorithms": [
        {
          "id": "ultimate_auto",
          "trigger": "on_cast",
          "inputs": [
            "physical_attack",
            "skill_level"
          ],
          "outputs": [
            {
              "type": "damage_physical",
              "formula": "(150 + 75 * (skill_level - 1)) + 1 * physical_attack",
              "magnitudeUnit": "flat"
            },
            {
              "type": "slow"
            }
          ]
        }
      ],
      "cooldownSeconds": [
        0.6,
        0.6,
        0.6
      ]
    }
  ],
  "sources": [
    {
      "field": "baseStats",
      "url": "https://mobile-legends.fandom.com/wiki/Granger",
      "retrieved": "2026-06-29"
    },
    {
      "field": "skills",
      "url": "https://mobile-legends.fandom.com/wiki/Granger",
      "retrieved": "2026-06-29"
    }
  ]
}
