{
  "schemaVersion": "1.0.0",
  "id": "valentina",
  "name": "Valentina",
  "releaseYear": 2021,
  "skillsVerified": false,
  "resourceType": "mana",
  "damageType": "magic",
  "roles": [
    "Mage"
  ],
  "specialties": [
    "Burst",
    "Finisher"
  ],
  "lanes": [
    "Mid"
  ],
  "maxLevel": 15,
  "baseStats": {
    "hp": {
      "base": 2701,
      "growth": 187.5
    },
    "hpRegen": {
      "base": 7.2,
      "growth": 0.3
    },
    "mana": {
      "base": 500,
      "growth": 100
    },
    "manaRegen": {
      "base": 4,
      "growth": 0.2
    },
    "physicalAttack": {
      "base": 115,
      "growth": 6.43
    },
    "magicPower": {
      "base": 0,
      "growth": 0
    },
    "physicalDefense": {
      "base": 21,
      "growth": 3.8571
    },
    "magicDefense": {
      "base": 15,
      "growth": 1.6429
    },
    "attackSpeed": {
      "base": 0.98,
      "growth": 0.0093
    },
    "attackSpeedRatio": 1,
    "movementSpeed": {
      "base": 240,
      "growth": 0
    },
    "critChance": {
      "base": 0,
      "growth": 0
    }
  },
  "skills": [
    {
      "slot": "passive",
      "name": "Primal Force",
      "maxLevel": 1,
      "algorithms": [
        {
          "id": "todo",
          "todo": "Author from wiki: https://mobile-legends.fandom.com/wiki/Valentina",
          "outputs": []
        }
      ]
    },
    {
      "slot": "skill_1",
      "name": "Shadow Strike",
      "maxLevel": 6,
      "algorithms": [
        {
          "id": "todo",
          "todo": "Author from wiki: https://mobile-legends.fandom.com/wiki/Valentina",
          "outputs": []
        }
      ]
    },
    {
      "slot": "skill_2",
      "name": "Arcane Shade",
      "maxLevel": 6,
      "algorithms": [
        {
          "id": "todo",
          "todo": "Author from wiki: https://mobile-legends.fandom.com/wiki/Valentina",
          "outputs": []
        }
      ]
    },
    {
      "slot": "ultimate",
      "name": "I Am You",
      "maxLevel": 3,
      "algorithms": [
        {
          "id": "todo",
          "todo": "Author from wiki: https://mobile-legends.fandom.com/wiki/Valentina",
          "outputs": []
        }
      ]
    }
  ],
  "sources": [
    {
      "field": "baseStats",
      "url": "https://mobile-legends.fandom.com/wiki/Valentina",
      "retrieved": "2026-06-29"
    }
  ]
}
