{
  "schemaVersion": "1.0.0",
  "id": "belerick",
  "name": "Belerick",
  "releaseYear": 2018,
  "skillsVerified": true,
  "resourceType": "mana",
  "damageType": "magic",
  "roles": [
    "Tank"
  ],
  "specialties": [
    "Crowd Control",
    "Regen"
  ],
  "lanes": [
    "Roam"
  ],
  "maxLevel": 15,
  "baseStats": {
    "hp": {
      "base": 2569,
      "growth": 225
    },
    "hpRegen": {
      "base": 8.4,
      "growth": 0.6
    },
    "mana": {
      "base": 500,
      "growth": 100
    },
    "manaRegen": {
      "base": 4,
      "growth": 0.2
    },
    "physicalAttack": {
      "base": 110,
      "growth": 7
    },
    "magicPower": {
      "base": 0,
      "growth": 0
    },
    "physicalDefense": {
      "base": 15,
      "growth": 2.7857
    },
    "magicDefense": {
      "base": 15,
      "growth": 1.6429
    },
    "attackSpeed": {
      "base": 1.01,
      "growth": 0.0121
    },
    "attackSpeedRatio": 1,
    "movementSpeed": {
      "base": 250,
      "growth": 0
    },
    "critChance": {
      "base": 0,
      "growth": 0
    }
  },
  "skills": [
    {
      "slot": "passive",
      "name": "Deadly Thorns",
      "maxLevel": 1,
      "algorithms": [
        {
          "id": "passive_auto",
          "trigger": "on_cast",
          "outputs": [
            {
              "type": "damage_magic",
              "formula": "60",
              "magnitudeUnit": "flat"
            }
          ]
        }
      ]
    },
    {
      "slot": "skill_1",
      "name": "Ancient Seed",
      "maxLevel": 6,
      "algorithms": [
        {
          "id": "skill_1_auto",
          "trigger": "on_cast",
          "inputs": [
            "magic_power",
            "skill_level"
          ],
          "outputs": [
            {
              "type": "damage_magic",
              "formula": "(200 + 20 * (skill_level - 1)) + 0.5 * magic_power",
              "magnitudeUnit": "flat",
              "hits": 2
            },
            {
              "type": "slow",
              "valuePercent": 25,
              "durationSeconds": 0
            },
            {
              "type": "taunt",
              "durationSeconds": 1.2
            }
          ]
        }
      ],
      "cooldownSeconds": [
        8,
        7.6,
        7.2,
        6.8,
        6.4,
        6
      ],
      "manaCost": [
        60,
        66,
        72,
        78,
        84,
        90
      ]
    },
    {
      "slot": "skill_2",
      "name": "Nature's Strike",
      "maxLevel": 6,
      "algorithms": [
        {
          "id": "skill_2_auto",
          "trigger": "on_cast",
          "inputs": [
            "magic_power",
            "skill_level"
          ],
          "outputs": [
            {
              "type": "damage_magic",
              "formula": "(300 + 30 * (skill_level - 1)) + 0.6 * magic_power",
              "magnitudeUnit": "flat"
            },
            {
              "type": "slow",
              "valuePercent": 60,
              "durationSeconds": 1.4
            }
          ]
        }
      ],
      "cooldownSeconds": [
        12,
        11.4,
        10.8,
        10.2,
        9.6,
        9
      ],
      "manaCost": [
        90,
        102,
        114,
        126,
        138,
        150
      ]
    },
    {
      "slot": "ultimate",
      "name": "Wrath of Dryad",
      "maxLevel": 3,
      "algorithms": [
        {
          "id": "ultimate_auto",
          "trigger": "on_cast",
          "inputs": [
            "magic_power",
            "skill_level"
          ],
          "outputs": [
            {
              "type": "damage_magic",
              "formula": "(100 + 50 * (skill_level - 1)) + 0.3 * magic_power",
              "magnitudeUnit": "flat",
              "hits": 4
            },
            {
              "type": "taunt",
              "durationSeconds": 1.5
            }
          ]
        }
      ],
      "cooldownSeconds": [
        50,
        46,
        42
      ],
      "manaCost": [
        150,
        150,
        150
      ]
    }
  ],
  "sources": [
    {
      "field": "baseStats",
      "url": "https://mobile-legends.fandom.com/wiki/Belerick",
      "retrieved": "2026-06-29"
    },
    {
      "field": "skills",
      "url": "https://mobile-legends.fandom.com/wiki/Belerick",
      "retrieved": "2026-06-29"
    }
  ]
}
