{
  "schemaVersion": "1.0.0",
  "id": "lunox",
  "name": "Lunox",
  "releaseYear": 2018,
  "skillsVerified": true,
  "resourceType": "mana",
  "damageType": "magic",
  "roles": [
    "Mage"
  ],
  "specialties": [
    "Burst",
    "Damage"
  ],
  "lanes": [
    "Mid"
  ],
  "maxLevel": 15,
  "baseStats": {
    "hp": {
      "base": 2880,
      "growth": 198.21
    },
    "hpRegen": {
      "base": 6.8,
      "growth": 0.3
    },
    "mana": {
      "base": 500,
      "growth": 100
    },
    "manaRegen": {
      "base": 4,
      "growth": 0.2
    },
    "physicalAttack": {
      "base": 115,
      "growth": 6.21
    },
    "magicPower": {
      "base": 0,
      "growth": 0
    },
    "physicalDefense": {
      "base": 18,
      "growth": 4.0714
    },
    "magicDefense": {
      "base": 15,
      "growth": 2.5
    },
    "attackSpeed": {
      "base": 1.01,
      "growth": 0.01
    },
    "attackSpeedRatio": 1,
    "movementSpeed": {
      "base": 240,
      "growth": 0
    },
    "critChance": {
      "base": 0,
      "growth": 0
    }
  },
  "skills": [
    {
      "slot": "passive",
      "name": "Dreamland Twist",
      "maxLevel": 1,
      "algorithms": [
        {
          "id": "passive_auto",
          "trigger": "on_cast",
          "outputs": []
        }
      ]
    },
    {
      "slot": "skill_1",
      "name": "Starlight Pulse",
      "maxLevel": 6,
      "algorithms": [
        {
          "id": "skill_1_auto",
          "trigger": "on_cast",
          "inputs": [
            "magic_power",
            "skill_level"
          ],
          "outputs": [
            {
              "type": "damage_magic",
              "formula": "(200 + 30 * (skill_level - 1)) + 1.1 * magic_power",
              "magnitudeUnit": "flat"
            }
          ]
        }
      ],
      "cooldownSeconds": [
        2,
        2,
        2,
        2,
        2,
        2
      ],
      "manaCost": [
        75,
        80,
        85,
        90,
        95,
        100
      ]
    },
    {
      "slot": "skill_2",
      "name": "Chaos Assault",
      "maxLevel": 6,
      "algorithms": [
        {
          "id": "skill_2_auto",
          "trigger": "on_cast",
          "inputs": [
            "magic_power",
            "skill_level"
          ],
          "outputs": [
            {
              "type": "damage_magic",
              "formula": "(250 + 20 * (skill_level - 1)) + 1.2 * magic_power",
              "magnitudeUnit": "flat"
            }
          ]
        }
      ],
      "cooldownSeconds": [
        2,
        2,
        2,
        2,
        2,
        2
      ],
      "manaCost": [
        30,
        35,
        40,
        45,
        50,
        55
      ]
    },
    {
      "slot": "skill_3",
      "name": "Cosmic Fission",
      "maxLevel": 6,
      "algorithms": [
        {
          "id": "skill_3_auto",
          "trigger": "on_cast",
          "inputs": [
            "magic_power",
            "skill_level"
          ],
          "outputs": [
            {
              "type": "damage_magic",
              "formula": "(300 + 40 * (skill_level - 1)) + 1.5 * magic_power",
              "magnitudeUnit": "flat"
            },
            {
              "type": "slow",
              "valuePercent": 40,
              "durationSeconds": 2
            }
          ]
        }
      ],
      "cooldownSeconds": [
        10,
        9.5,
        9,
        8.5,
        8,
        7.5
      ],
      "manaCost": [
        70,
        80,
        90,
        100,
        110,
        120
      ]
    },
    {
      "slot": "ultimate",
      "name": "Order & Chaos",
      "maxLevel": 3,
      "algorithms": [
        {
          "id": "ultimate_auto",
          "trigger": "on_cast",
          "inputs": [
            "magic_power",
            "skill_level"
          ],
          "outputs": [
            {
              "type": "damage_magic",
              "formula": "(250 + 100 * (skill_level - 1)) + 1 * magic_power",
              "magnitudeUnit": "flat"
            },
            {
              "type": "slow",
              "valuePercent": 30,
              "durationSeconds": 4
            }
          ]
        }
      ],
      "cooldownSeconds": [
        30,
        26,
        22
      ],
      "manaCost": [
        120,
        160,
        200
      ]
    }
  ],
  "sources": [
    {
      "field": "baseStats",
      "url": "https://mobile-legends.fandom.com/wiki/Lunox",
      "retrieved": "2026-06-29"
    },
    {
      "field": "skills",
      "url": "https://mobile-legends.fandom.com/wiki/Lunox",
      "retrieved": "2026-06-29"
    }
  ]
}
