{
  "schemaVersion": "1.0.0",
  "id": "balmond",
  "name": "Balmond",
  "releaseYear": 2016,
  "skillsVerified": true,
  "resourceType": "none",
  "damageType": "physical",
  "roles": [
    "Fighter"
  ],
  "specialties": [
    "Damage",
    "Regen"
  ],
  "lanes": [
    "Jungle"
  ],
  "maxLevel": 15,
  "baseStats": {
    "hp": {
      "base": 2558,
      "growth": 261
    },
    "hpRegen": {
      "base": 9.4,
      "growth": 0.6
    },
    "mana": {
      "base": 0,
      "growth": 0
    },
    "manaRegen": {
      "base": 0,
      "growth": 0
    },
    "physicalAttack": {
      "base": 119,
      "growth": 8.43
    },
    "magicPower": {
      "base": 0,
      "growth": 0
    },
    "physicalDefense": {
      "base": 25,
      "growth": 4.6429
    },
    "magicDefense": {
      "base": 15,
      "growth": 2.5
    },
    "attackSpeed": {
      "base": 1.06,
      "growth": 0.02
    },
    "attackSpeedRatio": 1,
    "movementSpeed": {
      "base": 260,
      "growth": 0
    },
    "critChance": {
      "base": 0,
      "growth": 0
    }
  },
  "skills": [
    {
      "slot": "passive",
      "name": "Bloodthirst",
      "maxLevel": 1,
      "algorithms": [
        {
          "id": "passive_auto",
          "trigger": "on_cast",
          "outputs": []
        }
      ]
    },
    {
      "slot": "skill_1",
      "name": "Soul Lock",
      "maxLevel": 6,
      "algorithms": [
        {
          "id": "skill_1_auto",
          "trigger": "on_cast",
          "inputs": [
            "physical_attack",
            "skill_level"
          ],
          "outputs": [
            {
              "type": "damage_physical",
              "formula": "(150 + 25 * (skill_level - 1)) + 0.6 * physical_attack",
              "magnitudeUnit": "flat"
            },
            {
              "type": "knockback",
              "durationSeconds": 0
            },
            {
              "type": "slow",
              "valuePercent": 40,
              "durationSeconds": 3
            }
          ]
        }
      ],
      "cooldownSeconds": [
        8,
        7.4,
        6.8,
        6.2,
        5.6,
        5
      ]
    },
    {
      "slot": "skill_2",
      "name": "Cyclone Sweep",
      "maxLevel": 6,
      "algorithms": [
        {
          "id": "skill_2_auto",
          "trigger": "on_cast",
          "inputs": [
            "physical_attack",
            "skill_level"
          ],
          "outputs": [
            {
              "type": "damage_physical",
              "formula": "(25 + 15 * (skill_level - 1)) + 0.25 * physical_attack",
              "magnitudeUnit": "flat",
              "hits": 14
            }
          ]
        }
      ],
      "cooldownSeconds": [
        6,
        6,
        6,
        6,
        6,
        6
      ]
    },
    {
      "slot": "ultimate",
      "name": "Lethal Counter",
      "maxLevel": 3,
      "algorithms": [
        {
          "id": "ultimate_auto",
          "trigger": "on_cast",
          "inputs": [
            "physical_attack",
            "skill_level"
          ],
          "outputs": [
            {
              "type": "damage_true",
              "formula": "150 + 0.7 * physical_attack",
              "magnitudeUnit": "flat"
            }
          ]
        }
      ],
      "cooldownSeconds": [
        34,
        29,
        24
      ]
    }
  ],
  "sources": [
    {
      "field": "baseStats",
      "url": "https://mobile-legends.fandom.com/wiki/Balmond",
      "retrieved": "2026-06-29"
    },
    {
      "field": "skills",
      "url": "https://mobile-legends.fandom.com/wiki/Balmond",
      "retrieved": "2026-06-29"
    }
  ]
}
