{
  "schemaVersion": "1.0.0",
  "id": "gloo",
  "name": "Gloo",
  "releaseYear": 2021,
  "skillsVerified": true,
  "resourceType": "mana",
  "damageType": "magic",
  "roles": [
    "Tank"
  ],
  "specialties": [
    "Regen",
    "Control"
  ],
  "lanes": [
    "Roam"
  ],
  "maxLevel": 15,
  "baseStats": {
    "hp": {
      "base": 2819,
      "growth": 240
    },
    "hpRegen": {
      "base": 12.4,
      "growth": 0.6
    },
    "mana": {
      "base": 500,
      "growth": 100
    },
    "manaRegen": {
      "base": 4,
      "growth": 0.2
    },
    "physicalAttack": {
      "base": 120,
      "growth": 6.43
    },
    "magicPower": {
      "base": 0,
      "growth": 0
    },
    "physicalDefense": {
      "base": 18,
      "growth": 3.3571
    },
    "magicDefense": {
      "base": 15,
      "growth": 2.5
    },
    "attackSpeed": {
      "base": 0.98,
      "growth": 0.0079
    },
    "attackSpeedRatio": 0.8,
    "movementSpeed": {
      "base": 245,
      "growth": 0
    },
    "critChance": {
      "base": 0,
      "growth": 0
    }
  },
  "skills": [
    {
      "slot": "passive",
      "name": "Stick, Stick",
      "maxLevel": 1,
      "algorithms": [
        {
          "id": "passive_auto",
          "trigger": "on_cast",
          "outputs": [
            {
              "type": "slow",
              "valuePercent": 4,
              "durationSeconds": 6
            }
          ]
        }
      ]
    },
    {
      "slot": "skill_1",
      "name": "Slam, Slam",
      "maxLevel": 6,
      "algorithms": [
        {
          "id": "skill_1_auto",
          "trigger": "on_cast",
          "inputs": [
            "magic_power",
            "skill_level"
          ],
          "outputs": [
            {
              "type": "damage_magic",
              "formula": "(300 + 30 * (skill_level - 1)) + 0.8 * magic_power",
              "magnitudeUnit": "flat",
              "hits": 2
            },
            {
              "type": "root",
              "durationSeconds": 1
            }
          ]
        }
      ],
      "cooldownSeconds": [
        10,
        9.2,
        8.4,
        7.6,
        6.8,
        6
      ],
      "manaCost": [
        25,
        30,
        35,
        40,
        45,
        50
      ]
    },
    {
      "slot": "skill_2",
      "name": "Spread, Spread",
      "maxLevel": 6,
      "algorithms": [
        {
          "id": "skill_2_auto",
          "trigger": "on_cast",
          "inputs": [
            "magic_power",
            "skill_level"
          ],
          "outputs": [
            {
              "type": "damage_magic",
              "formula": "(100 + 20 * (skill_level - 1)) + 0.8 * magic_power",
              "magnitudeUnit": "flat"
            },
            {
              "type": "root",
              "durationSeconds": 0.5
            }
          ]
        }
      ],
      "cooldownSeconds": [
        12,
        11.6,
        11.2,
        10.8,
        10.4,
        10
      ],
      "manaCost": [
        80,
        88,
        96,
        104,
        112,
        120
      ]
    },
    {
      "slot": "ultimate",
      "name": "Grab, Grab",
      "maxLevel": 3,
      "algorithms": [
        {
          "id": "ultimate_auto",
          "trigger": "on_cast",
          "inputs": [
            "magic_power",
            "skill_level"
          ],
          "outputs": [
            {
              "type": "damage_magic",
              "formula": "(30 + 30 * (skill_level - 1)) + 0.5 * magic_power",
              "magnitudeUnit": "flat"
            }
          ]
        }
      ],
      "cooldownSeconds": [
        50,
        50,
        50
      ],
      "manaCost": [
        150,
        150,
        150
      ]
    }
  ],
  "sources": [
    {
      "field": "baseStats",
      "url": "https://mobile-legends.fandom.com/wiki/Gloo",
      "retrieved": "2026-06-29"
    },
    {
      "field": "skills",
      "url": "https://mobile-legends.fandom.com/wiki/Gloo",
      "retrieved": "2026-06-29"
    }
  ]
}
