{
  "schemaVersion": "1.0.0",
  "id": "moskov",
  "name": "Moskov",
  "releaseYear": 2017,
  "skillsVerified": false,
  "resourceType": "mana",
  "damageType": "physical",
  "roles": [
    "Marksman"
  ],
  "specialties": [
    "Finisher",
    "Chase"
  ],
  "lanes": [
    "Gold"
  ],
  "maxLevel": 15,
  "baseStats": {
    "hp": {
      "base": 2255,
      "growth": 143
    },
    "hpRegen": {
      "base": 6.4,
      "growth": 0.2143
    },
    "mana": {
      "base": 500,
      "growth": 100
    },
    "manaRegen": {
      "base": 4,
      "growth": 0.2
    },
    "physicalAttack": {
      "base": 125,
      "growth": 10
    },
    "magicPower": {
      "base": 0,
      "growth": 0
    },
    "physicalDefense": {
      "base": 16,
      "growth": 4.2857
    },
    "magicDefense": {
      "base": 15,
      "growth": 2.5
    },
    "attackSpeed": {
      "base": 1.01,
      "growth": 0.005
    },
    "attackSpeedRatio": 1,
    "movementSpeed": {
      "base": 240,
      "growth": 0
    },
    "critChance": {
      "base": 0,
      "growth": 0
    }
  },
  "skills": [
    {
      "slot": "passive",
      "name": "Spear of Quiescence",
      "maxLevel": 1,
      "algorithms": [
        {
          "id": "todo",
          "todo": "Author from wiki: https://mobile-legends.fandom.com/wiki/Moskov",
          "outputs": []
        }
      ]
    },
    {
      "slot": "skill_1",
      "name": "Abyss Walker",
      "maxLevel": 6,
      "algorithms": [
        {
          "id": "todo",
          "todo": "Author from wiki: https://mobile-legends.fandom.com/wiki/Moskov",
          "outputs": []
        }
      ]
    },
    {
      "slot": "skill_2",
      "name": "Spear of Misery",
      "maxLevel": 6,
      "algorithms": [
        {
          "id": "todo",
          "todo": "Author from wiki: https://mobile-legends.fandom.com/wiki/Moskov",
          "outputs": []
        }
      ]
    },
    {
      "slot": "ultimate",
      "name": "Spear of Destruction",
      "maxLevel": 3,
      "algorithms": [
        {
          "id": "todo",
          "todo": "Author from wiki: https://mobile-legends.fandom.com/wiki/Moskov",
          "outputs": []
        }
      ]
    }
  ],
  "sources": [
    {
      "field": "baseStats",
      "url": "https://mobile-legends.fandom.com/wiki/Moskov",
      "retrieved": "2026-06-29"
    }
  ]
}
