{
  "schemaVersion": "1.0.0",
  "id": "julian",
  "name": "Julian",
  "releaseYear": 2022,
  "skillsVerified": false,
  "resourceType": "mana",
  "damageType": "magic",
  "roles": [
    "Fighter",
    "Assassin"
  ],
  "specialties": [
    "Chase",
    "Magic Damage"
  ],
  "lanes": [
    "Jungle"
  ],
  "maxLevel": 15,
  "baseStats": {
    "hp": {
      "base": 2878,
      "growth": 199
    },
    "hpRegen": {
      "base": 7.8,
      "growth": 0.4571
    },
    "mana": {
      "base": 500,
      "growth": 100
    },
    "manaRegen": {
      "base": 4,
      "growth": 0.2
    },
    "physicalAttack": {
      "base": 128,
      "growth": 9.21
    },
    "magicPower": {
      "base": 0,
      "growth": 0
    },
    "physicalDefense": {
      "base": 24,
      "growth": 3.5714
    },
    "magicDefense": {
      "base": 15,
      "growth": 1.6429
    },
    "attackSpeed": {
      "base": 0.99,
      "growth": 0.0286
    },
    "attackSpeedRatio": 1,
    "movementSpeed": {
      "base": 262,
      "growth": 0
    },
    "critChance": {
      "base": 0,
      "growth": 0
    }
  },
  "skills": [
    {
      "slot": "passive",
      "name": "Smith's Legacy",
      "maxLevel": 1,
      "algorithms": [
        {
          "id": "todo",
          "todo": "Author from wiki: https://mobile-legends.fandom.com/wiki/Julian",
          "outputs": []
        }
      ]
    },
    {
      "slot": "skill_1",
      "name": "Scythe",
      "maxLevel": 6,
      "algorithms": [
        {
          "id": "todo",
          "todo": "Author from wiki: https://mobile-legends.fandom.com/wiki/Julian",
          "outputs": []
        }
      ]
    },
    {
      "slot": "skill_2",
      "name": "Sword",
      "maxLevel": 6,
      "algorithms": [
        {
          "id": "todo",
          "todo": "Author from wiki: https://mobile-legends.fandom.com/wiki/Julian",
          "outputs": []
        }
      ]
    },
    {
      "slot": "skill_3",
      "name": "Chain",
      "maxLevel": 6,
      "algorithms": [
        {
          "id": "todo",
          "todo": "Author from wiki: https://mobile-legends.fandom.com/wiki/Julian",
          "outputs": []
        }
      ]
    }
  ],
  "sources": [
    {
      "field": "baseStats",
      "url": "https://mobile-legends.fandom.com/wiki/Julian",
      "retrieved": "2026-06-29"
    }
  ]
}
