{
  "schemaVersion": "1.0.0",
  "id": "brody",
  "name": "Brody",
  "releaseYear": 2020,
  "skillsVerified": false,
  "resourceType": "mana",
  "damageType": "physical",
  "roles": [
    "Marksman"
  ],
  "specialties": [
    "Burst",
    "Finisher"
  ],
  "lanes": [
    "Gold"
  ],
  "maxLevel": 15,
  "baseStats": {
    "hp": {
      "base": 2288,
      "growth": 164.93
    },
    "hpRegen": {
      "base": 7.2,
      "growth": 0.2286
    },
    "mana": {
      "base": 500,
      "growth": 100
    },
    "manaRegen": {
      "base": 4,
      "growth": 0.2
    },
    "physicalAttack": {
      "base": 105,
      "growth": 10
    },
    "magicPower": {
      "base": 0,
      "growth": 0
    },
    "physicalDefense": {
      "base": 20,
      "growth": 3.2857
    },
    "magicDefense": {
      "base": 15,
      "growth": 1.6429
    },
    "attackSpeed": {
      "base": 1.21,
      "growth": 0.05
    },
    "attackSpeedRatio": 0.7,
    "movementSpeed": {
      "base": 253,
      "growth": 0
    },
    "critChance": {
      "base": 0,
      "growth": 0
    }
  },
  "skills": [
    {
      "slot": "passive",
      "name": "Abyss Corrosion",
      "maxLevel": 1,
      "algorithms": [
        {
          "id": "todo",
          "todo": "Author from wiki: https://mobile-legends.fandom.com/wiki/Brody",
          "outputs": []
        }
      ]
    },
    {
      "slot": "skill_1",
      "name": "Abyss Impact",
      "maxLevel": 6,
      "algorithms": [
        {
          "id": "todo",
          "todo": "Author from wiki: https://mobile-legends.fandom.com/wiki/Brody",
          "outputs": []
        }
      ]
    },
    {
      "slot": "skill_2",
      "name": "Corrosive Strike",
      "maxLevel": 6,
      "algorithms": [
        {
          "id": "todo",
          "todo": "Author from wiki: https://mobile-legends.fandom.com/wiki/Brody",
          "outputs": []
        }
      ]
    },
    {
      "slot": "ultimate",
      "name": "Torn-Apart Memory",
      "maxLevel": 3,
      "algorithms": [
        {
          "id": "todo",
          "todo": "Author from wiki: https://mobile-legends.fandom.com/wiki/Brody",
          "outputs": []
        }
      ]
    }
  ],
  "sources": [
    {
      "field": "baseStats",
      "url": "https://mobile-legends.fandom.com/wiki/Brody",
      "retrieved": "2026-06-29"
    }
  ]
}
