{
  "schemaVersion": "1.0.0",
  "id": "freya",
  "name": "Freya",
  "releaseYear": 2016,
  "skillsVerified": true,
  "resourceType": "none",
  "damageType": "physical",
  "roles": [
    "Fighter"
  ],
  "specialties": [
    "Chase",
    "Damage"
  ],
  "lanes": [
    "Jungle"
  ],
  "maxLevel": 15,
  "baseStats": {
    "hp": {
      "base": 2550,
      "growth": 215
    },
    "hpRegen": {
      "base": 9.8,
      "growth": 0.4571
    },
    "mana": {
      "base": 0,
      "growth": 0
    },
    "manaRegen": {
      "base": 0,
      "growth": 0
    },
    "physicalAttack": {
      "base": 120,
      "growth": 8.71
    },
    "magicPower": {
      "base": 0,
      "growth": 0
    },
    "physicalDefense": {
      "base": 22,
      "growth": 4.3571
    },
    "magicDefense": {
      "base": 15,
      "growth": 2.5
    },
    "attackSpeed": {
      "base": 1,
      "growth": 0.02
    },
    "attackSpeedRatio": 1,
    "movementSpeed": {
      "base": 260,
      "growth": 0
    },
    "critChance": {
      "base": 0,
      "growth": 0
    }
  },
  "skills": [
    {
      "slot": "passive",
      "name": "Power of Einherjar",
      "maxLevel": 1,
      "algorithms": [
        {
          "id": "passive_auto",
          "trigger": "on_cast",
          "outputs": []
        }
      ]
    },
    {
      "slot": "skill_1",
      "name": "Leap of Faith",
      "maxLevel": 6,
      "algorithms": [
        {
          "id": "skill_1_auto",
          "trigger": "on_cast",
          "inputs": [
            "bonus_physical_attack",
            "skill_level"
          ],
          "outputs": [
            {
              "type": "damage_physical",
              "formula": "(200 + 20 * (skill_level - 1)) + 0.8 * bonus_physical_attack",
              "magnitudeUnit": "flat"
            },
            {
              "type": "airborne",
              "durationSeconds": 0.4
            }
          ]
        }
      ],
      "cooldownSeconds": [
        8,
        7.6,
        7.2,
        6.8,
        6.4,
        6
      ]
    },
    {
      "slot": "skill_2",
      "name": "Valkyrie Slash",
      "maxLevel": 6,
      "algorithms": [
        {
          "id": "skill_2_auto",
          "trigger": "on_cast",
          "inputs": [
            "skill_level"
          ],
          "outputs": [
            {
              "type": "damage_physical",
              "formula": "(150 + 30 * (skill_level - 1))",
              "magnitudeUnit": "flat"
            },
            {
              "type": "slow",
              "valuePercent": 30,
              "durationSeconds": 0.5
            }
          ]
        }
      ]
    },
    {
      "slot": "ultimate",
      "name": "Valkyrie Descent",
      "maxLevel": 3,
      "algorithms": [
        {
          "id": "ultimate_auto",
          "trigger": "on_cast",
          "inputs": [
            "physical_attack",
            "skill_level"
          ],
          "outputs": [
            {
              "type": "damage_physical",
              "formula": "(300 + 100 * (skill_level - 1)) + 0.75 * physical_attack",
              "magnitudeUnit": "flat"
            },
            {
              "type": "slow",
              "valuePercent": 40,
              "durationSeconds": 2
            }
          ]
        }
      ],
      "cooldownSeconds": [
        34,
        30,
        26
      ]
    }
  ],
  "sources": [
    {
      "field": "baseStats",
      "url": "https://mobile-legends.fandom.com/wiki/Freya",
      "retrieved": "2026-06-29"
    },
    {
      "field": "skills",
      "url": "https://mobile-legends.fandom.com/wiki/Freya",
      "retrieved": "2026-06-29"
    }
  ]
}
