{
  "schemaVersion": "1.0.0",
  "id": "ruby",
  "name": "Ruby",
  "releaseYear": 2017,
  "skillsVerified": true,
  "resourceType": "mana",
  "damageType": "physical",
  "roles": [
    "Fighter"
  ],
  "specialties": [
    "Crowd Control",
    "Regen"
  ],
  "maxLevel": 15,
  "baseStats": {
    "hp": {
      "base": 2331,
      "growth": 185
    },
    "hpRegen": {
      "base": 6,
      "growth": 0.5714
    },
    "mana": {
      "base": 500,
      "growth": 100
    },
    "manaRegen": {
      "base": 6,
      "growth": 0.2
    },
    "physicalAttack": {
      "base": 129,
      "growth": 6.93
    },
    "magicPower": {
      "base": 0,
      "growth": 0
    },
    "physicalDefense": {
      "base": 18,
      "growth": 4
    },
    "magicDefense": {
      "base": 10,
      "growth": 2.5
    },
    "attackSpeed": {
      "base": 1.07,
      "growth": 0.02
    },
    "attackSpeedRatio": 1,
    "movementSpeed": {
      "base": 260,
      "growth": 0
    },
    "critChance": {
      "base": 0,
      "growth": 0
    }
  },
  "skills": [
    {
      "slot": "passive",
      "name": "Let's Dance!",
      "maxLevel": 1,
      "algorithms": [
        {
          "id": "passive_auto",
          "trigger": "on_cast",
          "outputs": []
        }
      ]
    },
    {
      "slot": "skill_1",
      "name": "Be Good!",
      "maxLevel": 6,
      "algorithms": [
        {
          "id": "skill_1_auto",
          "trigger": "on_cast",
          "inputs": [
            "physical_attack",
            "skill_level"
          ],
          "outputs": [
            {
              "type": "damage_physical",
              "formula": "90 + 1.3 * physical_attack",
              "magnitudeUnit": "flat",
              "hits": 2
            },
            {
              "type": "slow",
              "valuePercent": 40,
              "durationSeconds": 1
            }
          ]
        }
      ],
      "cooldownSeconds": [
        4,
        4,
        4,
        4,
        4,
        4
      ],
      "manaCost": [
        25,
        25,
        25,
        25,
        25,
        25
      ]
    },
    {
      "slot": "skill_2",
      "name": "Don't Run, Wolf King!",
      "maxLevel": 6,
      "algorithms": [
        {
          "id": "skill_2_auto",
          "trigger": "on_cast",
          "inputs": [
            "physical_attack",
            "skill_level"
          ],
          "outputs": [
            {
              "type": "damage_physical",
              "formula": "(60 + 25 * (skill_level - 1)) + 0.55 * physical_attack",
              "magnitudeUnit": "flat",
              "hits": 2
            },
            {
              "type": "stun",
              "durationSeconds": 0.5
            }
          ]
        }
      ],
      "cooldownSeconds": [
        7,
        7,
        7,
        7,
        7,
        7
      ],
      "manaCost": [
        50,
        55,
        60,
        65,
        70,
        75
      ]
    },
    {
      "slot": "ultimate",
      "name": "I'm Offended!",
      "maxLevel": 3,
      "algorithms": [
        {
          "id": "ultimate_auto",
          "trigger": "on_cast",
          "inputs": [
            "physical_attack",
            "skill_level"
          ],
          "outputs": [
            {
              "type": "damage_physical",
              "formula": "(200 + 140 * (skill_level - 1)) + 2 * physical_attack",
              "magnitudeUnit": "flat"
            },
            {
              "type": "stun",
              "durationSeconds": 0.5
            }
          ]
        }
      ],
      "cooldownSeconds": [
        26,
        23,
        20
      ],
      "manaCost": [
        80,
        100,
        120
      ]
    }
  ],
  "sources": [
    {
      "field": "baseStats",
      "url": "https://mobile-legends.fandom.com/wiki/Ruby",
      "retrieved": "2026-06-29"
    },
    {
      "field": "skills",
      "url": "https://mobile-legends.fandom.com/wiki/Ruby",
      "retrieved": "2026-06-29"
    }
  ]
}
