{
  "schemaVersion": "1.0.0",
  "id": "gusion",
  "name": "Gusion",
  "releaseYear": 2018,
  "skillsVerified": false,
  "resourceType": "mana",
  "damageType": "magic",
  "roles": [
    "Assassin"
  ],
  "specialties": [
    "Burst",
    "Magic Damage"
  ],
  "lanes": [
    "Mid",
    "Jungle"
  ],
  "maxLevel": 15,
  "baseStats": {
    "hp": {
      "base": 2578,
      "growth": 165
    },
    "hpRegen": {
      "base": 7.8,
      "growth": 0.4429
    },
    "mana": {
      "base": 500,
      "growth": 100
    },
    "manaRegen": {
      "base": 4,
      "growth": 0.2
    },
    "physicalAttack": {
      "base": 119,
      "growth": 8.21
    },
    "magicPower": {
      "base": 0,
      "growth": 0
    },
    "physicalDefense": {
      "base": 18,
      "growth": 3.5
    },
    "magicDefense": {
      "base": 15,
      "growth": 1.6429
    },
    "attackSpeed": {
      "base": 1.11,
      "growth": 0.025
    },
    "attackSpeedRatio": 1,
    "movementSpeed": {
      "base": 260,
      "growth": 0
    },
    "critChance": {
      "base": 0,
      "growth": 0
    }
  },
  "skills": [
    {
      "slot": "passive",
      "name": "Dagger Specialist",
      "maxLevel": 1,
      "algorithms": [
        {
          "id": "todo",
          "todo": "Author from wiki: https://mobile-legends.fandom.com/wiki/Gusion",
          "outputs": []
        }
      ]
    },
    {
      "slot": "skill_1",
      "name": "Sword Spike",
      "maxLevel": 6,
      "algorithms": [
        {
          "id": "todo",
          "todo": "Author from wiki: https://mobile-legends.fandom.com/wiki/Gusion",
          "outputs": []
        }
      ]
    },
    {
      "slot": "skill_2",
      "name": "Shadowblade Slaughter",
      "maxLevel": 6,
      "algorithms": [
        {
          "id": "todo",
          "todo": "Author from wiki: https://mobile-legends.fandom.com/wiki/Gusion",
          "outputs": []
        }
      ]
    },
    {
      "slot": "ultimate",
      "name": "Incandescence",
      "maxLevel": 3,
      "algorithms": [
        {
          "id": "todo",
          "todo": "Author from wiki: https://mobile-legends.fandom.com/wiki/Gusion",
          "outputs": []
        }
      ]
    }
  ],
  "sources": [
    {
      "field": "baseStats",
      "url": "https://mobile-legends.fandom.com/wiki/Gusion",
      "retrieved": "2026-06-29"
    }
  ]
}
