{
  "schemaVersion": "1.0.0",
  "id": "claude",
  "name": "Claude",
  "releaseYear": 2018,
  "skillsVerified": false,
  "resourceType": "mana",
  "damageType": "physical",
  "roles": [
    "Marksman"
  ],
  "specialties": [
    "Burst",
    "Chase"
  ],
  "lanes": [
    "Gold"
  ],
  "maxLevel": 15,
  "baseStats": {
    "hp": {
      "base": 2370,
      "growth": 127.5
    },
    "hpRegen": {
      "base": 8,
      "growth": 0.2286
    },
    "mana": {
      "base": 0,
      "growth": 0
    },
    "manaRegen": {
      "base": 0,
      "growth": 0
    },
    "physicalAttack": {
      "base": 97,
      "growth": 7
    },
    "magicPower": {
      "base": 0,
      "growth": 0
    },
    "physicalDefense": {
      "base": 14,
      "growth": 3
    },
    "magicDefense": {
      "base": 15,
      "growth": 1.6429
    },
    "attackSpeed": {
      "base": 1.03,
      "growth": 0.015
    },
    "attackSpeedRatio": 1,
    "movementSpeed": {
      "base": 240,
      "growth": 0
    },
    "critChance": {
      "base": 0,
      "growth": 0
    }
  },
  "skills": [
    {
      "slot": "passive",
      "name": "Battle Side-by-side",
      "maxLevel": 1,
      "algorithms": [
        {
          "id": "todo",
          "todo": "Author from wiki: https://mobile-legends.fandom.com/wiki/Claude",
          "outputs": []
        }
      ]
    },
    {
      "slot": "skill_1",
      "name": "Art of Thievery",
      "maxLevel": 6,
      "algorithms": [
        {
          "id": "todo",
          "todo": "Author from wiki: https://mobile-legends.fandom.com/wiki/Claude",
          "outputs": []
        }
      ]
    },
    {
      "slot": "skill_2",
      "name": "Battle Mirror Image",
      "maxLevel": 6,
      "algorithms": [
        {
          "id": "todo",
          "todo": "Author from wiki: https://mobile-legends.fandom.com/wiki/Claude",
          "outputs": []
        }
      ]
    },
    {
      "slot": "ultimate",
      "name": "Blazing Duet",
      "maxLevel": 3,
      "algorithms": [
        {
          "id": "todo",
          "todo": "Author from wiki: https://mobile-legends.fandom.com/wiki/Claude",
          "outputs": []
        }
      ]
    }
  ],
  "sources": [
    {
      "field": "baseStats",
      "url": "https://mobile-legends.fandom.com/wiki/Claude",
      "retrieved": "2026-06-29"
    }
  ]
}
