{
  "schemaVersion": "1.0.0",
  "id": "zilong",
  "name": "Zilong",
  "releaseYear": 2016,
  "skillsVerified": false,
  "resourceType": "mana",
  "damageType": "physical",
  "roles": [
    "Fighter",
    "Assassin"
  ],
  "specialties": [
    "Chase",
    "Damage"
  ],
  "maxLevel": 15,
  "baseStats": {
    "hp": {
      "base": 2511,
      "growth": 217
    },
    "hpRegen": {
      "base": 7,
      "growth": 0.4
    },
    "mana": {
      "base": 500,
      "growth": 100
    },
    "manaRegen": {
      "base": 4,
      "growth": 0.2
    },
    "physicalAttack": {
      "base": 123,
      "growth": 9
    },
    "magicPower": {
      "base": 0,
      "growth": 0
    },
    "physicalDefense": {
      "base": 25,
      "growth": 4.6429
    },
    "magicDefense": {
      "base": 15,
      "growth": 2.5
    },
    "attackSpeed": {
      "base": 1.05,
      "growth": 0.02
    },
    "attackSpeedRatio": 1,
    "movementSpeed": {
      "base": 265,
      "growth": 0
    },
    "critChance": {
      "base": 0,
      "growth": 0
    }
  },
  "skills": [
    {
      "slot": "passive",
      "name": "Dragon Flurry",
      "maxLevel": 1,
      "algorithms": [
        {
          "id": "todo",
          "todo": "Author from wiki: https://mobile-legends.fandom.com/wiki/Zilong",
          "outputs": []
        }
      ]
    },
    {
      "slot": "skill_1",
      "name": "Spear Flip",
      "maxLevel": 6,
      "algorithms": [
        {
          "id": "todo",
          "todo": "Author from wiki: https://mobile-legends.fandom.com/wiki/Zilong",
          "outputs": []
        }
      ]
    },
    {
      "slot": "skill_2",
      "name": "Spear Strike",
      "maxLevel": 6,
      "algorithms": [
        {
          "id": "todo",
          "todo": "Author from wiki: https://mobile-legends.fandom.com/wiki/Zilong",
          "outputs": []
        }
      ]
    },
    {
      "slot": "ultimate",
      "name": "Supreme Warrior",
      "maxLevel": 3,
      "algorithms": [
        {
          "id": "todo",
          "todo": "Author from wiki: https://mobile-legends.fandom.com/wiki/Zilong",
          "outputs": []
        }
      ]
    }
  ],
  "sources": [
    {
      "field": "baseStats",
      "url": "https://mobile-legends.fandom.com/wiki/Zilong",
      "retrieved": "2026-06-29"
    }
  ]
}
