{
  "schemaVersion": "1.0.0",
  "id": "yi-sun-shin",
  "name": "Yi Sun-shin",
  "releaseYear": 2017,
  "skillsVerified": false,
  "resourceType": "mana",
  "damageType": "physical",
  "roles": [
    "Assassin",
    "Marksman"
  ],
  "specialties": [
    "Finisher",
    "Chase"
  ],
  "lanes": [
    "Jungle"
  ],
  "maxLevel": 15,
  "baseStats": {
    "hp": {
      "base": 2320,
      "growth": 150
    },
    "hpRegen": {
      "base": 7.2,
      "growth": 0.2286
    },
    "mana": {
      "base": 500,
      "growth": 100
    },
    "manaRegen": {
      "base": 4,
      "growth": 0.2
    },
    "physicalAttack": {
      "base": 110,
      "growth": 8
    },
    "magicPower": {
      "base": 0,
      "growth": 0
    },
    "physicalDefense": {
      "base": 22,
      "growth": 4.2857
    },
    "magicDefense": {
      "base": 15,
      "growth": 2.1429
    },
    "attackSpeed": {
      "base": 1.03,
      "growth": 0.01
    },
    "attackSpeedRatio": 1,
    "movementSpeed": {
      "base": 250,
      "growth": 0
    },
    "critChance": {
      "base": 0,
      "growth": 0
    }
  },
  "skills": [
    {
      "slot": "passive",
      "name": "Heavenly Vow",
      "maxLevel": 1,
      "algorithms": [
        {
          "id": "todo",
          "todo": "Author from wiki: https://mobile-legends.fandom.com/wiki/Yi_Sun-shin",
          "outputs": []
        }
      ]
    },
    {
      "slot": "skill_1",
      "name": "Traceless",
      "maxLevel": 6,
      "algorithms": [
        {
          "id": "todo",
          "todo": "Author from wiki: https://mobile-legends.fandom.com/wiki/Yi_Sun-shin",
          "outputs": []
        }
      ]
    },
    {
      "slot": "skill_2",
      "name": "Blood Floods",
      "maxLevel": 6,
      "algorithms": [
        {
          "id": "todo",
          "todo": "Author from wiki: https://mobile-legends.fandom.com/wiki/Yi_Sun-shin",
          "outputs": []
        }
      ]
    },
    {
      "slot": "ultimate",
      "name": "Mountain Shocker",
      "maxLevel": 3,
      "algorithms": [
        {
          "id": "todo",
          "todo": "Author from wiki: https://mobile-legends.fandom.com/wiki/Yi_Sun-shin",
          "outputs": []
        }
      ]
    }
  ],
  "sources": [
    {
      "field": "baseStats",
      "url": "https://mobile-legends.fandom.com/wiki/Yi_Sun-shin",
      "retrieved": "2026-06-29"
    }
  ]
}
