{
  "schemaVersion": "1.0.0",
  "id": "hanzo",
  "name": "Hanzo",
  "releaseYear": 2018,
  "skillsVerified": false,
  "resourceType": "energy",
  "damageType": "physical",
  "roles": [
    "Assassin"
  ],
  "specialties": [
    "Burst",
    "Poke"
  ],
  "lanes": [
    "Jungle"
  ],
  "maxLevel": 15,
  "baseStats": {
    "hp": {
      "base": 2594,
      "growth": 145
    },
    "hpRegen": {
      "base": 7,
      "growth": 0.4429
    },
    "mana": {
      "base": 0,
      "growth": 0
    },
    "manaRegen": {
      "base": 0,
      "growth": 0
    },
    "physicalAttack": {
      "base": 108,
      "growth": 11.43
    },
    "magicPower": {
      "base": 0,
      "growth": 0
    },
    "physicalDefense": {
      "base": 17,
      "growth": 4
    },
    "magicDefense": {
      "base": 15,
      "growth": 2.5
    },
    "attackSpeed": {
      "base": 1.09,
      "growth": 0.02
    },
    "attackSpeedRatio": 1,
    "movementSpeed": {
      "base": 260,
      "growth": 0
    },
    "critChance": {
      "base": 0,
      "growth": 0
    }
  },
  "skills": [
    {
      "slot": "passive",
      "name": "Ame No Habakiri",
      "maxLevel": 1,
      "algorithms": [
        {
          "id": "todo",
          "todo": "Author from wiki: https://mobile-legends.fandom.com/wiki/Hanzo",
          "outputs": []
        }
      ]
    },
    {
      "slot": "skill_1",
      "name": "Ninjutsu: Demon Feast",
      "maxLevel": 6,
      "algorithms": [
        {
          "id": "todo",
          "todo": "Author from wiki: https://mobile-legends.fandom.com/wiki/Hanzo",
          "outputs": []
        }
      ]
    },
    {
      "slot": "skill_2",
      "name": "Ninjutsu: Dark Mist",
      "maxLevel": 6,
      "algorithms": [
        {
          "id": "todo",
          "todo": "Author from wiki: https://mobile-legends.fandom.com/wiki/Hanzo",
          "outputs": []
        }
      ]
    },
    {
      "slot": "ultimate",
      "name": "Kinjutsu: Pinnacle Ninja",
      "maxLevel": 3,
      "algorithms": [
        {
          "id": "todo",
          "todo": "Author from wiki: https://mobile-legends.fandom.com/wiki/Hanzo",
          "outputs": []
        }
      ]
    }
  ],
  "sources": [
    {
      "field": "baseStats",
      "url": "https://mobile-legends.fandom.com/wiki/Hanzo",
      "retrieved": "2026-06-29"
    }
  ]
}
